{
  "schema_version": "1.0.0",
  "surface_key": "lesson-reading",
  "condition_key": "exact-version-unavailable",
  "mapping_version": "1.0.0",
  "guidance_id": "lesson-version-unavailable",
  "guidance_version": "1.0.0",
  "publication": {"state": "approved", "reviewed_on": "2026-10-18", "updated_at": "2026-10-18T00:00:00Z"},
  "source_references": [
    {"source_key": "contract-architecture", "title": "Contract architecture", "area": "contract", "source_version": "2026-10-18", "content_fingerprint": "54c441f89a90ce1d10f292d3e65a463c9e62c396664158cd01a144fed42b66bd"}
  ],
  "mapping_digest": "c1837ff5fd1f4cfcaa12a45938928ca7cb2f8be96728e209b64e269774dc8fbc"
}
